{"architecture":{"context_state":"persistent-derived-summary","hidden_width":4,"input_dimensions":4,"kind":"tiny-affine-tanh","learned_forward_passes":1,"output_dimensions":2,"reasoning_state":"none-after-preparation"},"architecture_identity":"sha256:8ee72d1282eac8c091cb2ebd0522fcd72fc09a6ba98bf16f64290b317e6b0375","artifact_identity":"sha256:fb1994bc16a65c3a21cb3b95093befbdbf9d7f36c04a2ffaf1419c2aa12b84aa","authority":"diagnostic-only","calibration_identity":"sha256:db8431a90e74bce699d3ec0e6d22c4257af7f2bb3bd615e4cf554966cf3762d1","checkpoint_identity":"sha256:3190bbbcfb252fc4142abd092d0cd2102aa91cb33ce671c420ee511e4e403300","class_labels":["irrelevant","relevant"],"distillation_identity":"sha256:c0d0b68d08870cc8e16c18d25c462d0388d07e5d4d506799f822e6a4e625c8ea","feature_center":[492,465,440,475],"hidden_bias":[-1.1739808229969506,-0.16472067392733597,1.1388451212811772,-1.5905173435476538],"input_weights":[[0.6753969126884765,0.7733133513548675,0.7316958461465339,0.7355029715767041],[0.22402472478747482,0.33664501092106947,0.14766551701907907,0.22759995499124483],[-0.6844603549965731,-0.7449423386979389,-0.6423136469973355,-0.7696672553787475],[0.9871629807391983,0.8727829882593194,0.8083298481486876,1.0649903608367897]],"model_identity":"sha256:e03237586802d58adc9bbfb9ea786ddd1ba3e031cedc9e9a37d75db10f4593e3","operating_envelope":{"envelope_identity":"sha256:1ddb82b9ac71cd8bdc2080cca9bfc1b0a19e20269be6888b923a4aca205ac2f1","maximum_context_observations":32,"maximum_distance":1352,"maximum_query_abs":1000,"minimum_confidence":900},"output_bias":[0.5369485030077782,-0.4024485030077775],"output_weights":[[-1.4821676022730363,-0.345827650547979,1.3640041698234613,-2.05867492473175],[1.4550676022730369,0.38292765054797895,-1.4857041698234583,2.0011749247317483]],"provider_abi":"mnel-specialist-provider-abi/0.1","provider_id":"mnel-one-step-distilled-specialist/0.1","schema":"mnel-one-step-specialist-artifact/0.1","semantics":"identity-bound-one-step-learned-specialist; diagnostic-only; not-a-verdict","source_observation_identities":["sha256:0fb47451ee0e775dcd217a71623974f9bf9d2187d25d6dae7fe2c1aac10cc03e","sha256:249da5b607a1307f45f891644f43fa640c33ac64b2225faa2d572e54f354a2a9","sha256:31f46b4a6417a9da7c9371a660bd26d61060ae1d808b5cdb1a23bcffdfd12444","sha256:326f4f543e4ff49f8e00b8bda62af7b866cdc2fb0c2b5f134c702d655031dc2f","sha256:3f57dcdc34c198a49f583ca6d5d3866d8be59f7f846c20de18092fbd136be28c","sha256:57d3bb4abc308769f4df3b821187b1caab26aaa998edfbf8a2c6dc8769005d0f","sha256:71c76f1756c96604c3e74b6c494922acb6089a17e47288258c44b55eaf34cd42","sha256:92c3c6414174102bf9054372a336a2d91124808a490dabecb4d92857e04e1205","sha256:c4de69391023c32c9b669ce58a22dae6096d17219312c601839142a32dc880ba","sha256:e9653b762c5d2d74a65d64a108f4b874add839bf5db72a77407f9527a9d69a55","sha256:f5fcc52f63a7244b93d76cf56c895224c813b7cea4580d4ca299562855ad2867"],"target_role":"forge.evidence-relevance","teacher_architecture_identity":"sha256:0b854e10e4fc3843017c7a264620bcfb2ace844ade15820e313e2a0faf737ab4","teacher_generation_identity":"sha256:2767857f27a108bee26d88acb05597c2233500dd81e69c89ac621d423c4917d4","teacher_model_identity":"sha256:b3c8ba2bd9672b2ea652a92d1fd81c4c2f15db76c59a4ee5ff5fb90b72d94f62","teacher_operating_envelope_identity":"sha256:7a7248d840ac9b048935ebdb6b34e5188526f4dea78d850357ed122d18d78a7e","teacher_provider_identity":"mnel-bounded-recurrent-specialist/0.1","training_code_identity":"sha256:a318ca2496556da8b591ab22f526531118d81284aa862c728f03538d8688b99c","training_dataset_identity":"sha256:835001ba074393893495cd064fc12eba14ec39d65b8c82fe13bfb47b47bb721c","training_record_ids":["sha256:2ba03c5c8b3c8eba9085e24a29c0266cf7193755d5aaf336a751584dc35c0944","sha256:2c8142f197514ba9fb6c922ec0c22cc6d14dbf7f12e54c9c79238feb08629d11","sha256:4241d223e76611c9ca974fc914ebb54124e335b00cf59fd9523a7b1894a088aa","sha256:5a74d5dbdc9affc79ed6d35421f89c85e68bf1375339b6e30dd53ecf9f62c9c6","sha256:5c4743b99fd1e79eef773d1b826a3613fb9ca5c2e75499ce30eab6816a93702d","sha256:76610ac42c04b5a73e190f5f8942388587ca5cc7155441b35b5276137262ecd2","sha256:96d35d6368875ab858973b959bddae3d655144a0e05831096865f79bb9b86a61","sha256:d655cc21314aa9387b5e4aaf16dbdf7df996b37b3c94d26571dc5be9ccece880"],"training_spec_identity":"sha256:e7965aceee1ad2d9e1a6e6442eb743a2edf2f1238a562c36b9de66141aa8c344"}